{
    "uid": "01J8Z3K4M5N6P7Q8R9S0T1V2V2",
    "sku": "TEE-ORGANIC-BLUE-L",
    "type": "simple",
    "parent_uid": "01J8Z3K4M5N6P7Q8R9S0T1V2C1",
    "status": "enabled",
    "family": "apparel",
    "categories": [
        "t_shirts"
    ],
    "channels": [
        "default"
    ],
    "values": {
        "common": {
            "sku": "TEE-ORGANIC-BLUE-L",
            "color": "blue",
            "size": "l",
            "price": {
                "EUR": "12.00",
                "USD": "13.50"
            },
            "cost": {
                "EUR": "-0.5"
            }
        }
    },
    "updated_at": "2026-09-24T16:45:12Z"
}
